address,author,comment,date,title
"São Paulo, SP",Wagner Schalch,"O tal do italiano realmente construiu instalações dignas de um paraíso na Terra. Aquela região da Lagoa do Paraíso é muito linda, com águas deliciosamente quentinhas. Crianças se divertiram muito. Comida boa. Preço meio salgado, mas acho que vale a pena.", fevereiro de 2019,"Caro, mas vale a pena"
"Manaus, AM",MariTolentino,"Um lugar muito agradável. Fui em época de baixa temporada, então estava muito tranquilo, foi possível sentir o lugar.", junho de 2019,Um paraiso pra descansar
"Janaúba, MG",cajunia,"Ambiente agradável, porém nada como nas fotos. Chegamos com chuva e estava frio. A água é doce e não era azul. Lugar ok. E bem puxado os preços. Muitos mosquitos nas comidas e bebidas. Não tinha como comer em paz ", janeiro de 2020,Chegamos com chuva 
"Rio de Janeiro, RJ",PabloBGoncalves,"A Lagoa do Paraíso é muito bonita, agradável para ficar sem fazer nada, brincar com as crianças, etc.  O beach club tem uma ótima estrutura. A entrada custa 20,00 por adulto. O único ponto fraco é o preço das comidas e bebidas, muito salgado. Não sei se fora da alta temporada é", janeiro de 2020,"Ótima estrutura, bom atendimento, preço caro"
"Belo Horizonte, MG",joão pp,"A lagoa do paraíso é tudo que falam e mais um pouco..! Gostei tanto que fui duas vezes. Águas bem verdes, calmas, quentes... o nome cai muito bem: um verdadeiro paraíso! Visitei duas barracas, uma paga (muito  boa) e outra mais simples, mas o banho é bom em todas!", janeiro de 2020,Melhor atração!
,Ana Paula,"Curtimos a Lagoa do Paraíso na parada da Casa B&B. Foi uma ótima experiência pois tivemos quase exclusividade neste ponto, sem exploração, serviço de primeira! A lagoa é linda e pode ser aproveitada com tranquilidade! Recomendo.", dezembro de 2019,Férias!
,Juscelino Cássio,"A melhor parada do passeio entre o Oeste e o Leste foi a Lagoa do Paraíso. Os outros lugares são legais, paisagem natural linda, mas nenhuma se compara a lagoa do paraíso.", janeiro de 2020,Lagoa do Paraíso a melhor parada
"Belo Horizonte, MG",Gallo Semppre,"Só na volta o bugueiro nos contou que ano passado uma das barracas em volta da lagoa fez uma obra que minou água barrenta para a lagoa, que, assim, não está aquela beleza das fotos... Os preços da barraca que fiquei não são razoáveis. Imagino que os custos dos comerciantes são", janeiro de 2020,Já foi linda
"Belo Horizonte, MG",Sheyla S,"Ambiente agradável, pena que chegamos muito tarde e o local já estava fechando, o restaurante não é barato, custo de praia, uma long neck sai por R$15,00 mas vale passar pelo menos um dia por lá, ainda conta com opções de stand up a R$30,00 15 min.", dezembro de 2019,Vale a visita
"Fortaleza, CE",Bruna Felix,Um dos lugares mais encantadores que já conheci. Simplesmente fantástico. Vale muito a pena conhecer., julho de 2019,Maravilhoso 
"Arraial d'Ajuda, BA",Eryka A,"Perfeito, ficamos do lado privativo com bangalô e tudo com tudo que uma férias merecidas deve ter. Amei ", janeiro de 2020,Lindo 
,Milena Amorim,"O lugar é bonito, tem música ao vivo e muitos pontos para tirar uma foto legal, porém foi o passeio que menos gostei de todos que fiz. ", dezembro de 2019,Não é tudo isso que dizem
"Bauru, SP",Isabele A,"A lagoa é muito gostosa para ficar o dia inteiro, mesmo quando a cor da água não está tão bonita, o que varia de acordo com a época de ano e ocorrência de chuvas. Para chegar lá pode ser por bugue (fizemos o passeio para o leste, que parou lá) ou pegando a jardineira na vila,", outubro de 2019,Lindo e água tranquila
,Maria Claudia F,"Achei muito fraco da parte do guia. Não tivemos a opção de ir no Beach Club Alchymist, levaram a gente no bar que não estava no passeio, comida de péssima qualidade. Junto com as outras pessoas solicitamos levar a gente no bar que a gente queria conhecer, o guia cobrou uma valor", dezembro de 2019,Chegando na lagoa
"São Paulo, SP",Beatriz S R Jesus,"Lagoa com grande quantidade de bares e restaurantes. Atenção à época de visita, não recomendada em períodos chuvosos (a paisagem das fotos não será a mesma).", janeiro de 2020,Vale a visita!
,Guilherme Vendramini,"Chegando na lagoa o guia informou que existem opções de descida, uma no Alchemist (pago) e outra mais adiante (grátis) ambas com opções de restaurantes. Descemos na segundo opção, ja que para entrar no Alchemist  é preciso pagar R$20,00 por pessoa, além dos restaurantes serem", janeiro de 2020,Bonito o local
"Lisboa, Portugal",fernandorossiarq,"A Beach Club Alchymist é um ambiente maravilho e com excelente serviço. Sugiro que utilize os flutuadores, onde se paga um pouco mais, mas vale!!!", janeiro de 2020,Um excelente dia de lazer
"Embu das Artes, SP",DulcineiaRamos,"Um bom lugar para relaxar, nadar,    almoçar. Estar com a família.  Preços justos.  Eu recomendo o passeio. ", janeiro de 2020,Lugar interessante 
"São Paulo, SP",germanosm,A lagoa do paraíso é uma usual opção de passeio para quem visita Jericoacoara. Porém A coloração da sua água já foi mais clara e atrativa., janeiro de 2020,Bate e volta de Jeri
"São Paulo, SP",Cileni Oliveira,"Amei conhecer a Lagoa do Paraiso, realmente um lugar lindo, tranquilo com uma estrutura maravilhosa: Guarda-sois, Redes dentro da água, barcos de enfeite para fotos. Um Passeio Imperdível, fomos de  BUGUI. ", dezembro de 2019,Lagoa faz jus ao nome
"Rondonópolis, MT",Raiany B,"O ambiente é ótimo, o atendimento de qualidade, mas o preço é realmente salgado, surreal. A lagoa para banho é ótima!", janeiro de 2020,"Bom, mas muito caro "
"Brasília, DF",hazenclever,Um excelente passeio. A estrutura é fantástica e a lagoa de temperatura gostosa. Os preços que são um pouco salgados. , janeiro de 2020,EXCELENTE PASSEIO!
,Tati M,"Lugar bonito , mas de preços altos e apenas 01 banheiro para TODOS os frequentadores . Lotado nesta época, com muitas crianças e o atendimento deixa a desejar. ", janeiro de 2020,Muito populoso
"Jandira, SP",ICosta2013,"É um lugar muito agradável, para quem quer relaxar a mente e o corpo Vale a pena ir sem pressa. Sem preocupação com horário.  Recomendo a visita. ", dezembro de 2019,Muito agradável
"São Paulo, SP",Elainecrisouza,Vale a pena conhecer. Ficamos no Restaurante do Paulo.  Otimo local. Otimo atendimento. Show de bola ficar deitada naquela rede dentro da agua. , dezembro de 2019,Lugar lindo
"São Paulo, SP",Karla,A lagoa do paraíso é um local turístico e conta uma taxa de 20 reais por pessoa! A visita vale cada centavo. Para quem tiver condições reserve o lounge privativo e mergulhe nessa experiência incrível! , janeiro de 2020,Maravilhosa 
"Brasília, Distrito Federal, Brazil",CidaBorges2013,"Lugar muito lindo, boa estrutura, vale muito a pena conhecer... O acesso é um pouco dificil por causa que o local não tem calçamento, só areia....", novembro de 2019,Realmente um paraíso na Terra
"Marabá, PA",Walyson Lima,"Fui lá achando que encontraria uma água azulzinha e transparente igual vi em algumas fotos, porém não achei nada disso! kk  O lugar até que é bonito, mas não tem nada demais. Achei os preços cobrados pelos restaurantes um absurdo!!! Muito caro pela estrutura que oferecem.  De", dezembro de 2019,"Vale a pena conhecer, mas não espere nada demais"
"Niterói, RJ",carlavarella,"A Lagoa fica distante uns 40 minutos do centro de Jeri. Sugiro conhecer a Lagoa, através de um Passeio de Buggy, pois vale super a pena e é bem mais legal do que ir de Jardineira, caso tenha tempo e queira voltar em outro dia para aproveitar a lagoa, aí sim vale a pena ir de", dezembro de 2019,Lagoa Deliciosa para curtir os momentos em Jeri.
"Belo Horizonte, MG",Ricardo V,"É um local muito bom de se conhecer. A maioria dos bares possuem redes para deitar e atendimento beira da lagoa. Recomendo ficar no alchimist, um restaurante especial no início da lagoa.", dezembro de 2019,Muito bom 
,Maria C,"Apesar de ser mais bonita por fotos, é um ótimo ambiente para banho e para se passear com a família. Possui uma excelente estrutura com duchas, mesas, banheiros e espaço para relaxar, porém todos os custos são altos principalmente alimentação.", dezembro de 2019,Ótima para banho
"Rio de Janeiro, RJ",Nicholas M,Apenas uma lagoa com restaurantes ao redor dela. Não achei nada demais não. Mas vale conhecer sim! E bonito, janeiro de 2020,Bonita lagoa 
"Ribeirão Preto, SP",acmiranda16,"Lugar super agradável, com bangalôs bem estruturados e confortáveis, pratos feitos com qualidade e bom atendimento.", dezembro de 2019,Jericoacoara - Réveillon 2020
"Petrolina, PE",Wandemberg Magalhães,"Ótimo lugar para almoçar, apesar de ser pequeno, e a estrutura é razoável. Foi bom o descanso aqui, pois tínhamos muito ainda a percorrer nesse passeio de um dia em Jeri.", outubro de 2019,Relaxar e apreciar
"Algarve, Portugal",Joe joe,"é um lugar agradável , mas não estava especular , já que avia muito vento e os caminho com muitos carros ", dezembro de 2019,é agradável 
"Albufeira, Portugal",Btriz,"Lagoa do paraíso, uma lagoa a visitar, e ótimo para descansar, almoçar e descontrair junto da água !  ", dezembro de 2019,Muito bonito !! 
"Biritiba-Mirim, SP",Amauri S,"Mas não crie muita expectativa, o espaço é pequeno muitas mesas faz o espaço e a beleza se perderem,pouco atrativos", dezembro de 2019,Visitavel
,Marcella B,"Fomos na te lotada de final de ano, local muuuito cheio, esperava muito mais. O atendimento é até legal pelo tanto que estava cheio, mas as porções deixam muito a desejar.", dezembro de 2019,Esperava Muuuuuito mais 
"Bogotá, Colômbia",Charles A,Povo feio e mal educado. Pegam uma mesa e ficam o dia inteiro tomando e comendo o q levaram no isopor.... mas tem Gosto pra td..., dezembro de 2019,Show de horrores 
"São Paulo, SP",Yuki_Kato,"Visitei  a lagoa diversas vezes até 2017. Retornei em dezembro de 2019 e descobri que acabaram com o ambiente natural da lagoa. Agora há um lounge, com esteiras sobre a água. Não dá mais para ver o azul da lagoa.  Um horror", dezembro de 2019,Acabaram com o lugar!!
"Penha, SC",Margarete S,"Local abandonado! Banheiros sujos, sem nenhum cuidado. A única coisa boa foi colher manhã direto do pé ! ", dezembro de 2019,Decepção 
"Indaiatuba, SP",Amanda,"A propaganda é muito enganosa! Não vi aquela coloração da água igual nas fotos no Google, aqui mesmo ou em qualquer outro lugar, com filtro realmente elas ficam, mas sem, não há nada de mais. Simplesmente uma lagoa com redinhas...", dezembro de 2019,As fotos enganam
Santa Catarina,Claudio A,"Bom apenas para quem se preocupa exclusivamente com fotos para redes sociais. Lagoa ""ao vivo"" não é tão interessante. A comida caríssima dispensa comentários (40 reais uma ""micro"" porção de batatas fritas no Alchymist). Passeio de quadriciclo pelas praias e dunas (e suas belas", dezembro de 2019,Muita propaganda e...quase só isso.
"Brasília, DF",Andre.edf,"O lugar é maravilhoso para repousar corpo e mente. É incrível como as redes na água nos transmitem calmaria e tranquilidade. Para entrar no lugar mais chique das fotos é necessário pagar. Há opções em outras pousadas em que você apenas paga o que consumir, e o preço das", dezembro de 2019,Sombra e água fresca.
"Paço do Lumiar, MA",Leo,"Lugar lindo e único!  Uma praia de água doce com tons esverdeados cristalinos. Apesar do valor de acesso ser R$ 20,00, aconselho à todos que forem em Jeri, visitar esse lugar", dezembro de 2019,Lugar Lindo e único!
"Rio de Janeiro, RJ",Margareth C. Portela,"Linda! Vale a pena! Nos deram a dica de ficar na Pousada/restaurante do Paulo, que tem uma boa estrutura e uma boa comida. Gostamos muito!  ", dezembro de 2019,Vale a dica!
"Curitiba, PR",Leandro M,Parte do passeio Leste.Lugar bonito. Vale a pena ficar algumas horas descansando em algum bar/restaurante da lagoa. O Alchimist tem uma estrutura espetacular mas também cobra por isso. Outros lugares próximos tem uma estrutura mais simples mas a beleza do local é igual em todos, dezembro de 2019,Jericoacoara pode se resumir a isso.
"Rio de Janeiro, RJ",Alessandra S,"O local é bem movimentado por todo tipo de pessoa. É ótimo para família, casais e grupo de amigos. Particularmente não fiquei no Alchymist, preferi o restaurante Lua Cheia que fica mais a frente do clube, pois, não cobram a entrada e nem as cadeiras na lagoa. Lugar muito", novembro de 2019,O Paraíso
"Jericoacoara, CE",Dannilo Sena,"Estrutura muito boa, os preços são um pouco exorbitantes para uma comida normal, mas pela estrutura vale a pena a visita ", dezembro de 2019,Vale a pena
"Salvador, BA",Vivi,"O lugar é lindo! Para quem contempla a natureza! Difícil de chegar e caro, considerando tudo! Mas compensa sim. Entrada R$ 20,00, os pratos são mais caros que em Jericoacoara, então decidimos não almoçar. Vi alguns comentários sobre a cor da água... mas observei que são de", dezembro de 2019,Sensacional 
"São Paulo, SP",Beatriz G,Visita de um dia a lagoa do paraíso e parada na barraca de beach paraíso tem boa estrutura mas o que salva e a novamente a hospitalidade do povo do Ceará! Preços de alta estação e qualidade nota 6. Mas vale muito o passeio!!!, dezembro de 2019,Lagoa do Paraíso - Jericoacoara 
,Eduardo M,"Ficamos na barraca alchimist, lugar lindo, paisagismo a deslumbrante, no passeio do Leste é o melhor lugar de se visitar e de ficar o dia todo, ótima infraestrutura, lagoa muito gostosa, água clara e morna. Achei os preços um pouco alto pela quantidade de comida, mas vale a pena", dezembro de 2019,Lugar maravilhoso
"São Paulo, SP",Luciana l,"A lagoa é bonita mas você só vai chegar a ela despejado no tal do Alquimist, muito provavelmente. Lá, colocaram tanta parafernália na água que alterou toda a paisagem : lounge flutuante (paga caro pra entrar, estaba vazio), estacionamento de stand up paddles, caiaques, pier, as", dezembro de 2019,Lagoa bonita mas nem tanto 
"Volta Redonda, RJ",thalisns,"Preço salgado no alchymist. A parada anterior durante o passeio leste, no buraco azul, é muito mais bonita e o restaurante muito mais em conta. Vale a pena ficar mais tempo no buraco azul e fazer o almoço lá. ", dezembro de 2019,Caro e lugar nem tão bonito
"Mogi das Cruzes, SP",Ricardo e Mayara,"Local muito bonito, estrutura muito boa, diversas mesas, banheiro limpo.  Porém muito caro, muto cheio e a comida não vale o valor pago.  Visita realizada em: 2017.", julho de 2019,Lagoa maravilhosa.
"Fortaleza, CE",Marcos Barbosa,Lugar perfeito para apreciar a natureza e curtir deitado numa rede dentro da lagoa com uma água deliciosa refrescando suas costas. É uma verdadeira benção!, dezembro de 2019,É um paraíso essa Lagoa!
"Recife, PE",Tatiane S,"Linda a lagoa, um verdadeiro paraíso, um lugar para recarregar as energias , descansar e apreciar a paisagem.", dezembro de 2019,Um paraíso da Natureza
,ra-anastacio,"Praia de água doce, poucas ondas e tranquila para a diversão das crianças e familiares. Ponto turístico e por ser área de preservação ambiental, alguns alimentos não são servidos na faixa de areia. No seu entorno possui ótimos restaurantes.", dezembro de 2019,Lagoa do Paraíso
,Ivana B,"Lugar agradável. Ótimo para relaxar, mas antes de ir escolha o transporte,  pode ser a passeio com os bugeiros ou de lotação que vc pega na Rua São Franciso, por R$25 reais por pessoa cada trecho.  Mas vale a pena ir, muito legal ", dezembro de 2019,Amei
"Campinas, SP",Elói G,"O lugar é lindo! Você paga 20 reais para entrar, porém vale cada segundo. Paisagens belíssimas para tirar fotos. O preço das coisas ali é um pouco salgado, mas vale a pena.", dezembro de 2019,Incrível esse lugar! 
,Josy,"Um lugar incrível,pra quem ama calmaria.com certeza um dos melhores lugares do mundo para passar as férias, com um povo muito receptivo", dezembro de 2019,Um verdadeiro paraíso
,Analuz,"Adorei o lugar, bem cuidado, bem transado, projeto bem feito! Drinks lindos! Bom atendimento! Lagoa deliciosa para banho, rende belíssimas fotos!!! Adorei e indico!!!", novembro de 2019,Lindo point turístico!
"Campinas, SP",Brunno Henrique S,"O forte de Jeri em relação a banhos são as lagoas formadas pela agua das chuvas entre Abril e Junho.  A lagoa do paraíso não tem esse nome a toa. Ela é bem extensa e, em funcao dos ventos, faz com que suas margens parecam uma praia de agua doce. Otimo lugar para nadar,", dezembro de 2019,Melhor região de Jeri
"Salvador, BA",Ane S,"Lugar maravilhoso, muito limpo,bonito. Clima maravilhoso . Comida de qualidade, variedade de bebidas. Vale a pena conferir !  .", dezembro de 2019,Passeio
"Santa Rita de Caldas, MG",nelson o,"Lugar ideal para descansar e passar o dia todo. Boa comida, ótimo atendimento. A lagoa é imensa e suas águas são quentes e limpas. Tem opções de brinquedos aquáticos para crianças. Muito relaxante!!!", dezembro de 2019,Tranquilidade e comodidade
"Nova Lima, MG",Wilsonamotta,A atração Lagoa do Paraiso meio que se confunde com o Alchimist Beach Club.  O local é de uma beleza única. A temperatura da região da lagoa é mais agradável do que na beirada da praia e na vila.  No Club a areia foi colocada na beira da lagoa para parecer uma praia e fazer com, dezembro de 2019,Passeio Incrível!!!
Estado de São Paulo,Dinnanni,"Fomos fazer o passeio e nominal paramos no Lagoa do Paraíso.tem que pagar $20,00 por pessoa.acima de 60e crianças isentos da taxa. Um lugar lindo, super limpo uma estrutura ótima.o restaurante é um pouco caro.so pra ter uma ideia 2 espetos de queijo coalho custa $37,00.mas", dezembro de 2019,Lugar com infra estrutura 
"Fortaleza, CE",Rogério Silva,"Lugar muito bonito e tranquilo,belas paisagem com opção de passeio de jangada,standup entre outros,com redes a beira da lagoa,por sinal muito limpo.", outubro de 2019,MUITO LINDO
"Salvador, BA",dribarretto,Com certeza um dos lugares q mais gostamos em Jeri e as crianças tb! Não pode faltar no seu roteiro!, dezembro de 2019,Lugar lindo
"Betim, MG",Lim L,"Lugar agradável e fascinante, ideal pra passar o dia em família e tirar ótimas fotos deitado nas redes ", dezembro de 2019,Bom
,Gabriel T,"Lagoa extensa com águas lindas e muito vento. Areia branquinha. Parece mesmo que você está no paraíso. Como a lagoa é muito grande, existem alguns pontos de apoio ao longo dela. Alguns mais badalados, como o Alchymist Beach Club, e outros mais tranquilos como a Casa B&B. ", dezembro de 2019,O paraíso é ali! 
,Mauro Luiz Albonetti,"em familia, lindo lugar, super agradável, com bom aperitivos e cozinha contemporanea, local bem estruturado, embora de difícil acesso. ", dezembro de 2019,Lazer
"Rio de Janeiro, RJ",Mariana P,"Essa é a Lagoa mais tradicional de Jeri! Aquela das fotos, com as redes dentro da água. Ela faz parte do passeio ""lado leste"". Fica um pouco longe, mas como tem várias paradas no caminho, acaba sendo agradável. Ficamos no Alchemist Beachclub, mas tem opções nas redondezas que", dezembro de 2019,Lindo
"Belo Horizonte, MG",Janice S,"Lugar lindo, tem várias opções de barraquinhas, fiquei na barraca Nova Esperança e gostei muito do atendimento e da estrutura do lugar.", dezembro de 2019,Lugar maravilhoso
"Manaus, AM",Dalvo M,"Tem uma estrutura belíssima, muito bem planejado. Existe uma área reservada, uma espécie de lounge com guarda-chuva que custa R$50,00. Eis que tinham apenas 3 casais e muitas mesas vagas e pedi ao garçom “chiquinho” que colocasse a cadeira no lado direito (que o guarda-chuva”", dezembro de 2019,Maus tratos... 
"Santo André, SP",Fernanda D,"Adoramos o lugar, com estrutura para o turista, atendimento rápido,  ótimo pra passar uma manhã!! Mas fique atento pois existem vários pontos pro turista, e o Alchimist é lindo, mas um pouco caro!! Para quem quer gastar menos, existem outros pontos na Lagoa, oferecendo o mesmo", setembro de 2019,Realmente o Paraíso!!
"Rio de Janeiro, RJ",Jefferson B,"Quem vai a Jeri, não pode deixar de ir pelo menos 01 dia neste paraíso da natureza, ambiente maravilhoso para curtir e esquecer da vida", novembro de 2019,MARAVILHA
"Jijoca de Jericoacoara, CE",Niel_Transfer_tur,"Lugar top para vc curtir cm uma companhia agradavel! Agua doce e Cristalina,e uma redinha na agua pra relaxar!! Whatsapp 88 988589545", novembro de 2019,Lagoa do paraíso
,Christian Vital,A Lagoa eh linda e as instalações do alquimisty são ótimas.  O grande PROBLEMA  eh que vc fica refém do restaurante que tem uma cozinha PÉSSIMA  além de ser super caro. Recomendo ir conhecer e vazar !!! , novembro de 2019,O local eh mto lindo 
"Peruíbe, SP",sergiotichauer,"Lugar delicioso para apreciar a natureza, deitado numa rede dentro da Lagoa. Passeios de jangada. Quiosques GRATUITOS para tomar um aperitivo, degustar umas porções e deitar nas espreguiçadeiras. ", novembro de 2019,Contemplando a natureza
"Salvador, BA",Deise R,"Vale a pena fazer esse passeio. Linda lagoa, com redes dentro d'água. Ótimo para passar o dia.  Obs: o bugueiro te diz opções de barraca, para você escolher. Porém, existe uma muito conhecida, renomada , chamada Alquimist...então, as informações são passadas incompletas para os", novembro de 2019,"Perfeita, mas cuidado com a escolha da barraca que deseja ficar"
"Belo Horizonte, MG",Raquel,"Local muito bonito, porém ficamos um pouco refém do restaurante local - alquimista. Não vale a pena ficar muito tempo.", novembro de 2019,Deixou a desejar 
"Rio de Janeiro, RJ",luciaregg,O que vale são as redinhas. O restante é Turistão!!! Comida ruim. Atendimento precário. Tudo caro. Temos que conhecer rodinhas raiz., novembro de 2019,Programa Turistão!!!
Estado de São Paulo,632francisco,Nada  a ver com as fotos mostrada  local  deixa  a desejar preços  muito  caro  atendimento  muito  ruim  dos restaurantes , novembro de 2019,Férias 
"Joinville, SC",Edilene C,"Lindo o lugar... fomos no restaurante Alquimist, simplesmente maravilhoso. Um passeio totalmente diferente. Um previlégio ter conhecido um lugar tão bonito. Ótimo restaurante, vale muito a pena ter ficado na parte mais vip do restaurante com tendas com camas e cobertura à beira", novembro de 2019,Sensacional 
"Fortaleza, CE",Luis P,"Uma lagoa com uma boa estrutura para turistas, paisagens maravilhosas, água boa para banho e ótimos lugares para fotos", novembro de 2019,Legal
"Tiradentes, MG",Gabriela R,"Tarde deliciosa, a lagoa é linda e muito grande, as mesas não ficam coladas e tem muita estrutura, várias barracas boas. Muito lindo!", novembro de 2019,Que lugar!
"Rio de Janeiro, RJ",Marcio Rezende,"Um beach club muito bem estruturado. R$ 20,00 a entrada ao clube. Área VIP com valor de R$ 100, só para entrar. Atendimento um pouco confuso, porém o ambiente é muito bom.", outubro de 2019,VALE A PENA CONHECER
,Francielle B,"Mudou a paisagem, prefiro ela rasa. Tem mais claridade e beleza . Mas ainda vale muito conhecer, é uma das melhores dessa lagoa ", novembro de 2019,"Mudou a paisagem, prefiro ela rasa. Tem mais claridade e beleza . Mas ainda vale muito conhecer, é uma das melhores"
"Curitiba, PR",Gleici Alves,"Um verdadeiro paraíso. Uma pena eu ter ido num feriado e estar lotada, ainda assim consegui aproveitar. Tem que ir!", novembro de 2019,Faz jus ao nome
"Recife, PE",wfranco,Atendimento diferenciado com equipe qualificadíssima. Cardápio com excelente opções e drinks maravilhosos. Local maravilhoso e com instalações em bom estado de uso. , novembro de 2019,Descobrindo o paraíso 
"São Paulo, SP",Everton Vieira,"Maravilhoso, lugar incrível o passei inteiro eh muito bom, comida gostosa... Redes para descanso...🌅🏖️ Várias atividades para divertimento.", novembro de 2019,Lugar incrível
"Jericoacoara, CE",Valber Arley,"O lugar é muito bonito, mas quando fomos a lagoa estava meio cheia devida as chuvas do meio do ano o que comprometeu um pouco a experiência. Chegamos lá pelo Alchymist, a estrutura é ótima, mas o preço e o serviço deixaram a desejar.", novembro de 2019,Lugar bonito
"Lago Norte, DF",Tatiana Linhares,"Lugar legal, ambiente diferente, mas achei muito caro. Vale a visita se estiver incluso em um passeio.", novembro de 2019,Legal
"Araruama, RJ",Leonidia,"Local aconchegante, água doce, serviço de restaurante em conta. Comida muito gostosa e bem servida. Drinks e cerveja com preços acessíveis. Visual deslumbrante. Local familiar tranquilo. Vale muito a pena conhecer, para mim, meu marido e meus cunhados, foi o lugar mais lindo de", setembro de 2019,Lindo Visual
"Salvador, BA",Elianio Augusto,"Excelente passeio, ficamos na ALCHYMIST BEACH CLUB, vale a pena conferir. Paga-se 20,00 por pessoa para entrar. Lugar bacana, bem cuidado. Tem opções mais em conta na lagoa. ", novembro de 2019,Jeri@Fortaleza
Barra Mansa,JuLoraBM,"Achei o ponto alto de Jeri! Visual lindo, água morna e doce! Ótimo pra relaxar. O vento fica mais forte no final da tarde.", novembro de 2019,Lugar lindo 
"São Bento do Sapucaí, SP",Maria Cristina S,"Lugar lindo, com uma vibe ótima, drinks muito gostosos e muito bom atendimento! Adoramos e voltaremos certamente!", outubro de 2019,Maravilhoso
"São Luís, MA",Pedro Leite,"Local muito bonito e com boa estrutura de bar e restaurante. Vale a visita com certeza, seja em casais, famílias, etc. ", novembro de 2019,Parada obrigatória
"Campinas, SP",Priscila C,"Lugar muito bem cuidado e com espaço gostoso para passar o dia, se não fosse o vento que é insuportável e o atendimento. Almoçamos por lá e percebi que o restaurante Alchymist não trabalha com produtos de qualidade, acredito que pensam que não precisam fidelizar o cliente.", novembro de 2019,Não voltaria 
