address,author,comment,date,title
"São Paulo, SP",Aline A,"A lagoa do paraíso é muito linda, e vale a pena a visita. Entretanto a infra-estrutura deixa a desejar, pois ou você paga um rim no Alchymist ou tem sorte. Almoçamos em um restaurante na beira da lagoa, por indicação do bugueiro, uma peixada com Camarões que nos deu azia. Veio", novembro de 2019,Somente a lagoa vale a pena
"Santo André, SP",kelly c,"Um lugar que não tem a água da cor das fotos,menos água do que eu imaginava,nada de mais, sinceramente,não era nada do que esperei por 4 anos um lugar que eu achava Que seria surreal.triste", dezembro de 2018,Água morna foi o ponto positivo
,marcoantonior662,"Local extremamente aprazível, cercado de belezas naturais, em ambiente ainda preservado. Houve intervenções (como, por exemplo, a estrutura do Alchymist), de bom gosto, mas dissonante da naturalidade do ambiente. Há outras opções que oferecem conforto um pouco menor, mas comida", setembro de 2019,Vale o nome!
"Rio de Janeiro, RJ",Andrea Costa,Visitamos no final de outubro de 2019 e ficamos encantados com tamanha beleza. Passamos um dia muito  agradável em contato com a naturez., novembro de 2019, O Paraíso é  aqui
,Getulio V,"Lugar para passar o dia, com bastante estrutura, bem atendido e bem servido. Prepara o bolso, é mais caro que as opções do centro de Jeri. Mas não tem como ir a Jeri e não conhecer.", outubro de 2019,Alchymist é muito bom
Estado de São Paulo,Mirian R,"O lugar é lindo, mas minha dica é pesquisar os meses ante de ir, pois há meses em que chove muito e a Lagoa não fica legal para visitação a água fica escura e a Lagoa muito cheia, existem pontos de apoio que a gente pode passar o dia comendo e bebendo e curtindo musica, os", junho de 2019,Adorei o lugar
,Deia SS,"Realmente é um lugar lindo,  tranquilo,  a água está na temperatura ideal, tem pontos com estruturas de bares e restaurantes e tem pontos mais rústicos,  amei tudo na Lagoa do Paraíso!", outubro de 2019,Lugar Paradisíaco!
,Heitor,A visão é de encher os olhos por dois motivos: pela beleza artificial do lugar e pelos preços a pagar., novembro de 2019,Enche os Olhos
"Londrina, PR",Bruno L,"Local muito bonito, mas se engana quem acha que vai chegar lá e ter a aquela água azul e cristalina como as fotos da internet.. puro filtro.. mas local bonito.. uma pena o restaurante ser u.a fortuna e a gente não ter escolha, se for lá tem q entrar.. lugar para conhecer uma", novembro de 2019,Muito bom
"Rio de Janeiro, RJ",Gabrielacw,"Lugar lindo, águas mornas, vale a pena conhecer, venta bastante, mas a Lagoa é muito bonita, fiz o passeio com a jardineira do Pedro", novembro de 2019,Lindo!
"Anápolis, GO",Vanessa Fonseca,"Vale a pena passear pro lado Oeste de Jeri pata conhecer todas as lagoas, principalmente a Lagoa do Paraíso. Lugar lindo!! ", novembro de 2019,Deslumbrante
"Serra Negra, SP",marcelo n,"Este ano com a chuva forte no inicio do ano, a lagoa esta super cheia. Fizeram um  repaginacao total, varios locais para fotos. Somente uma resalva ao atendimento dos garçons, enorme quantidade e pouquisimos realmente trabalhando. Vale o passeio. R$ 20,00 para conhecer o local", novembro de 2019,"Está mais bonita,"
,vandia b,"Lugar lindo! há varias barracas com estrutura. A mais conhecida é a alchimist, mas fiquei em outra ao lado, com preços bem mais em conta : Lua Cheia", setembro de 2019,lagoa do paraiso
"Palhoça, SC",Luciane Veiga,"O lagoa é muito bonita. O único ponto é pagar para ficar ali na região. Os valores do estabelecimento que cuida do local é um pouco salgado, mas o atendimento muito bom. Conforme nos comunicaram, as águas não estavam tão azuis devido a chuva que teve na região, mas mesmo assim,", outubro de 2019,Muito bonita!
"São Paulo, SP",Neci Alves,"O lugar faz jus ao nome, é simplesmente espetacular! Vale muito a visita, dá pra ficar só aí um dia inteiro!", outubro de 2019,Lugar maravilhoso!
,Luiza Mary F,"Lugar fantástico, cercado de dunas e com redes dentro d'água. Não pode deixar de visitar. Voltarei com certeza .", outubro de 2019,Maravilhosa
,Bruno A,"O local é lindo, mas não é para qualquer bolso não, o Alquimist Beach clube é pago até para entrar, 20 reais por pessoa, professores tem desconto. Belíssimo lugar, aproveitamos a lagoa ao lado da área vip...(bangalôs pagos a parte) ", outubro de 2019,Lugar lindo
"Jericoacoara, CE",Camila Sanf,"Vale a pena o passeio belissimo, fiz o passeio no dia da volta a Fortaleza e vale muito a pena. Voltarei mais vezes ", outubro de 2019,Belissimo 
,Hellogyn,"O lugar é bonito, cercado por dunas de areia branca. É possível fazer passeios de jangada, e standup paddle. Disseram-me que a cor da água neste ano está mais escura por conta das chuvas. Se puder aproveitar o local sem ficar refém do Achemyst, melhor para vc! É provável que se", outubro de 2019,Mais bonita que a Lagoa Azul
"Londrina, PR",Elaine Fereti,"Lugar realmente para descansar. Fomos com criança de 18 meses que brincou na área, se divertiu na água calma e teve bastante suporte dos garçons que se preocuparam com melhor lugar quando ele dormiu. Sem contar na alimentação e sucos/água de coco caprichados.  Voltaria com", setembro de 2019,Lugar de descanso
,luisalof,Lagoa quentinha e bonita. Havia algumas redes para deitar. Gostei do local. A lagoa era verde. Havia opção de fazer passeio de kaiake., outubro de 2019,Linda lagoa
"Joinville, SC",Jeferson2212,"A lagoa, naturalmente é linda. Mas a estrutura do Local ""Lagoa do Paraíso"" é péssima. Fizemos o pedido (garçom disse que ficaria pronto em meia hora). Levaram uma hora e quinze minutos para entregar 4 ""nugget"" de Filet Mignon que parecia mais uma sola de sapato, com uma salada", outubro de 2019,"Comida cara e ruim, atendimento precário."
"Londrina, PR",Joana M,"Ao ler as dicas de viagens em vários sites, achei que o local seria realmente um paraíso, maravilhoso, coisa de cinema. Chegamos com uma expectativa muito grande de conhecer um ""baita"" lugar lindo, porem ao chegar no local foi um tanto decepcionante. Reservei um dia na pousada,", setembro de 2019,Paraiso??? Será???
"Embu das Artes, SP",Riana,"O local e maravilhoso tanto de ambiente , quanto para fotos ,a praia é super tranquila,pra mim foi um dos melhores passeios que fiz em Jericoacoara.", outubro de 2019,Paraíso 
"Valinhos, SP",Ingridmdsl,"A lagoa do paraíso é bonita porém esperava mais do Local devido aos tantos comentários, fui em um bate volta e os guias te deixam no quiosque que possuem parceria, achei os preços bem salgados, sobre a lagoa não estava azul conforme vemos nos folder informativos!", outubro de 2019,Bonito
"Rio do Sul, SC",Ivan Borgonovo,A logoa é bem normal. Igual as outras. O club particular que tem pago é muito caro e com poucas atrações., outubro de 2019,Bem normal
"Campinas, SP",Gaby S,"Fiquei no nova esperança por indicação do guia, valor acessível e não precisa pagar entrada além de ser super tranquilo sem muita gente.", outubro de 2019,Ótima
,Thiago A,"A Lagoa é bonita, embora eu esperasse mais. O que afeta a experiência, negativamente é a baixa qualidade do Club Alchymist quanto ao atendimento do restaurante. Preços caríssimos e quantidade insuficiente de comida para duas pessoas.", outubro de 2019,Esperava mais
"Jericoacoara, CE",Leila R,"Passeio muito bom, vale a pena!... O que não agradou foi o restaurante da lagoa do paraiso, The Alchymist Beach Club, comida cara, mal feita e pouquíssima  quantidade, no cardápio diz que serve duas pessoas, mas a porção é somente para uma pessoa! ", outubro de 2019,Passeio lado leste 
"Rio de Janeiro, RJ",Wallison Guedes,"Lugar é lindo. A entrada é através do Club Alchymist e custa R$20,00. O clube em si não vale a pena. Mas a lagoa é linda. Estava super lotada no dia em que estive lá e a experiência não foi boa por isso. A lagoa estava clarinha, mas não tão transparente. Venta muito no lugar e", outubro de 2019,Lugar Lindíssimo! 
"Campinas, SP",Maria Lucia S,"O local é maravilhoso, muito agradável, uma estrutura ótima para descanso e passeios, comida boa e lugares espetaculares para fotos. Os preços são acessíveis.", setembro de 2019,Paraíso
"Teresina, PI",Jorge M,"Passeio imperdível. A estrutura atende às diversas classes econômicas. Atenção para chegar cedo, o lugar costuma estar sempre lotado.", outubro de 2019,Paradisíaca
,Carlos Melo,"Uma lagoa paradisíaca, aconchegante e propícia para relaxar... Um lugar para ser feliz e refletir sobre a vida...", outubro de 2019,CARLITOS TRIP
"Porto Alegre, RS",Gabgarcez,"A Lagoa é linda e possui mais de uma opção para alimentação. Também tem aluguel de caiaques e redes (de graça) para tirar foto. Um dos locais cobra entrada e é mais caro, o outro não cobra e a alimentação também é mais barata.", outubro de 2019,Linda paisagem
"São Leopoldo, RS",Viviane K,"A estrutura é incrível, um lugar para relaxar, as redes dentro da água são relaxantes, sem explicação é o paraíso! Vale a pena conhecer.", outubro de 2019,Lugar incrivel
,Idalmiro J,"Lugar realmente magnifico, faz jus ao nome ""Paraíso"" passamos um dia no alchymist, realmente muito bom, atendimento ótimo, comida muito boa perfeito, só a caipirinha que não é das boas, mas o restante é tudo perfeito, porem tudo tem seu preço é um lugar que tem os preços um", outubro de 2019,Paradisíaco
"Santana do Paraíso, MG",Juliana A,Uma pena que devido as fortes chuvas  de 2019 uma lagoa que tem a água mais escura transbordou e afetou diretamente a cor da água da lagoa do paraíso.  Somente na beirada da lagoa que é possível ver aquela água cristalina.  Pessoal da região estima que em média demorará cerca de, agosto de 2019,Sensacional
,Isabel Ferreira,"O local é muito TOP, com uma lagoa que fica entre as dunas de areia com uma infraestrutura muito boa. Porém prepare os bolsos, pois cobram desde a entrada por pessoa até às espreguiçadeiras. Dispõe de restaurantes com drinks lindos mas os valores são altos e a comida não achei", outubro de 2019,Estrutura incrível
"Botucatu, SP",Adriano Andrade,"Local bacana para tomar algo, petiscar e passar algumas horas se refrescando. Venta bem como em qualquer ponto de Jeri. Existem algumas barracas para servir os visitantes, uma bem cara com excelente infra estrutura e outras mais rústicas com preços melhores ", outubro de 2019,Bacana
,Rinaldo,O nome faz jus ao lugar....Lindo e relaxante...Parece que estamos numa praia do Caribe! Ótima infraestrutura!, outubro de 2019,Encantador!
,Vera Cardial,"Fiquei surpresa em encontrar, no meio do nada, esse lugar paradisíaco!. Lagoa de Aguas limpas e com pequenas ondas geradas vento!  Bom atendimento, variedade de comidas e drinks. Preços compatíveis com o lugar... Ponto a melhorar: Sinalizar na entrada que maiores de 60 anos não", outubro de 2019,Um lugar surpreendente!
"Rio de Janeiro, RJ",DKRJ18,Espetacular vale a pena q visitar esplendor de lugar imperdível não há palavras para descrever tanta beleza , outubro de 2019,Maravilha 
Distrito Federal,Milena Santos,"O lugar é incrível em cada detalhe seu, sem dúvida a viagem foi maravilhosa. E o guia fez com que ela se tornasse melhor ainda.. Não vejo a hora de voltar de novo☀️🌊⛵️❤️", outubro de 2019,Incrível
"Jericoacoara, CE",Zeno,"Excelente Estado CE,ótimas praias, restaurante e pousadas,por onde passei os colaboradores foram eficientes.", outubro de 2019,Viagem de conhecimento
"São Bernardo do Campo, SP",E9772VBmarco,"Excelente,  o nome já diz tudo. Atendimento de primeiro mundo. O barato é ir de bugue e ir bem cedo para aproveitar ao máximo aquele paraíso.", setembro de 2019,Lagoa do Paraíso
,Estanislau J,"Lugar lindo e relaxante, para descansar e curtir amigos.  Preços um pouco alto, no entanto vale a pena.", outubro de 2019,Férias
"São Paulo, SP",Gisela Rainho,"Amei ter visitado e aproveitado algumas horas nesta Lagoa. Bastante limpa, água gostosa, tudo de bom.", setembro de 2019,Maravilhoso
